Poem,Number of Versus,Poet,Century,Label,Type,Metre
"رأتني مجدّاً فاستهلت جفونها
بدمع كتهتان الغمامة واكف
وحنت لو شك البين لطفاً ورأفة
بقلب رحيم بالمودة عاطف
فعجت إليها للوداع مسلماً
وقد حثني للنفر نبأة هاتف
فلما التقى الكفان أبكى بكاؤها
عيون نساء حولها ووصائف
وقد علمت أني سموت لهمة
يعز مقامي بعدها في الخوالف
فقلت لها إِذ أجهدت في تثبطي
ورامت منيّ وقفة المتعاطف
أفيقي لك الخيرات من عبرة البكا
ولا تهلكي وجداً لفرقة آلف
ولا تحسبيني بعد ما صرت حافظاً
لأول آي العنكبوت بواقف
وهل لحميّ أن يخيم بعد ما
رأى الدين مقهوراً فمن للمعارف
أأرضى عن الأخرى بمنزل نقلة
يمر بمن فيه كقذفة قاذف
لي الويل إِن لم أجهد النفس أو أمت
صريعاً وإلاَّ شارياً في طوائف
ولا أدرك المأمول إِلا بعزمة
تفل غرابين المنى والتساوف
وفرقة أحباب وصرم لذاذة
ونفي رقاد واجتياز مخاوف
أراعك إِذ قال الجهول بأمرنا
أمامهم بحر كثير المتالف
كأن فتى رام الجهاد يروعه
هياج أذي مزبد متقاذف
سنعبره باللّه في نصر دينه
إِذا عام فيه عائم للملاطف
سنعبر في لج البحار تغلغلاً
إلى أخوة شمّ الأنوف غطارف
لكل فتى منهم عزيمة فيصل
وشدة ضرغام وهمة عارف
أولاك أقاموا الحق بعد عرائك
شداد وطعن بالقنا وتساويف
أولاك بهم تحيى هشيمة ديننا
وتدوى بساتين الطغى والمعازف
سيعلم دغار بن أحمد والفتى
سلالة مهدي وكل مخالف
إِذا نزل المستنصرون بجحفل
يهزون بيضاً كالبروق الخواطف
بأن لنا للعز والدين معصماً
وللّه حزباً قادماً في التزاحف
ألا رب مسرور بعصمة أحمد
إِذا عوينت فوق الذرى والحقائف
ألا رب مكروب شجي إِذا بدت
تجر قناها في وجيب الشراسف
ستعنى وجوه المبطلين وتلتوي
إِذا أخذوا بالحق أخذة عانف
ستقصر أيدي المبطلين عن الخطا
وخطرتهم بين الملا في الرفارف
سيرجع قطب الدين في مستقره
ويجزى سمام الهلك أهل المعازف
وما العز إلا للاله ورسله
وللمؤمنين الغر قرَّا المصاحف
فيا أيها الأحزان أنتم ملاذنا
وأسلافكم كانوا ملاذ السوالف
ذكرنا كم لما غطتنا حنادس
من الجور لما يحصها وصف واصف
وجئنا بلا أيد ولا فئة ولا
سلاح ولا مال تليد وطارف
وليس على الضرا يعد سواكم
لكشف غياهيب الدجى المترادف
فلا تشمتوا الأعداء بالحق بعدما
أذعنا له نصراً على كل خائف
فكم شاحب رث العزيمة خلفنا
ومستنصح يرجو انتصاراً وخائف
وصلوا على زين القيامة أحمد
شفيع البرايا عند نشر المصاحف
مدى الدهر ما هبت رياح وما جرت
سيول شآبيب السحاب الرواجف","<p class=""d-inline-block px-2 mt-0 mb-1 poem-control main-color"">عدد الابيات : 37</p>",إبراهيم الحضرمي,اليمن,قصائد رومنسيه,عموديه,بحر الطويل
"إِني لغير سفاح منك فاعترفي
أهوى الحسان ولا يغررك منصرفي
ما من فتى نجد حل الشباب به
إِلا يحب عناق البدَّن الهيف
لا عن قلى قبضت نفسي أعنتها
عنكن يا حسنات الحلي واللحف
أنتن قرة عين لم أقل فندا
أنتن أحسن ما في الدهر من تحف
لو كنت أدرك ما يعتافكن علي
كنتن من حيث مجاري الصدر في كنف
لكن نأت درجات المجد عن رجل
يمسي ويصبح بين الخرَّد القطف
فاستيقني نبأ أن العلا نزعت
أسيافها رغبتي عنكنَّ فانصرفي
حاز العلا وعلا فوق العلا صعداً
من راح منتصراً بالبتر القذف
إن الهلاك وأسباب الهلاك وما
يجدي الهلاك هو الاخلاد في الكنف
ليس امرؤ برز الصحراء مطلباً
عزا كمضطجع في ظلة السقف
يال الصلاة ويا آل الزكاة متى
أرجو إجابتكم قد طال معتكفي
يال الرجال إلى كم لا يزعزعكم
شعري ويردعكم صوتي وملتهفي
لو كنت أقرع جلموداً أجاب فما
أجفاكم عرباً بالصارخ اللهف
نمتم وبت أقاسي كيف أنقذكم
من غمرة السفها إني بكم لحفي
هيهات أبعدما في البعد حيث نأى
ما بين مبتسم ناء ومكتلف
ليت الاله كما أني أخو أنف
أولاكم أنفاً صعباً كما أنفي
كيف الرضى ومتى أرضى وكلكم
يسعى لخدمة أهل الظلم والحيف
مالي أرى صوراً حسناً ولا مهجاً
فيها تدافع ظلم الظالم الصلف
ما بال من عرف الأحكام يملكه
من ليس يفرق بين الميم والألف
شلت أكفكم إن لم تكن خلقت
إلاَّ لمس جلود الغيد والغلف
من لم يكن وله كف مسلمة
يحمي الذمار بها فاعدده في الجيف
من ذاق طعم ثلاث باح مجرمه
طعم العسولة والابلاد والضعف
لا خير في رجل تحميه ذمته
ملقى الجنان قميّ الوجه كالوصف
أكرم بفتية صدق عشرة عبرت
بحر الجزائر في الرحمن لم تخف
إن الذين لهم في البحر مختلف
أولى البرية في التقديم والشرف
هل مثل معبد من زار الامام على
كلّ ثلاثة أسفار أخي الثقف
أو هل كمثل أبي عبد الاله أخي
عامين عمنْ يحمد اللّه من أنف
وافخر وحسبك يا ابن الشيخ مفتخراً
الأريحي وزد في وصفه وصف
واذكر أخاك أبا إسحاق أن له
عزماً يفلُّ غرار المنصل الرهف
واعرف لخدنك ذي الأفضال أحمد ما
من كبر همته شاهدت واعترف
وارفع ظنونك بالثوري أي فتى
مذ قام قام ولم ينكل ولم يقف
ثم اعترف لأبي بكر فضيلته
ذاك الفتى الماجد ابن الماجد الأنف
يا رائحاً عجلاً حييت حي أبي
عني معا وعن القاضي الرضي الثقفي
من قام قبل يقوم الناس غير ونٍ
ومن بقي وقد انسلوا إلى الغرف
شيخاً رآى طلبي فرضاً فقام بما
حملت محتملاً ها ذاك غير خفي
ساق الزمان به عنفاً ليبلوه
فازداد مبتسماً والدهر ذو عنف
أكرم به فله بين الورى سلف
يعلو به الشرق العالي على الشرف
للّه ماثرة للدين ثبتها
والدهر ينقلها خلف إِلى خلف
إن همتي كبرت فالأمر همته
والنجل لا جرم نصر من الطرف
إني لمن حسنات الشيخ واحدة
ما كنت معترفاً أو غير معترف
حييت يا أبتي حييت قد وردت
إخواننا الفضلا حييت وازدلف
والبس هديت لباس الحرب منتجدا
وارتد بأردية التشمير والتحف
ما بعد إذ نزلوا إلاَّ التي رجفت
منها قلوب أولي الطغيان والسرف
حرب تأجج كالنيران يشعلها
ضرب ملوح منسوب إلى العجف
ظمآن منصله ظمآن قد عرفت
منه الحقيقة عند الزحف والزلف
يهوى الطعان يحب الضرب يطربه
وقع القنا وصرير البيض بالحجف
حان القيام بما يبكيك لادمعت
عيناك من جزع يا ربة الشنف
لا تصدعي ببكاك القلب واعتصمي
صبراً فلست على حال بمرتقف
إني أحب على حد السيوف بأن
أمضي على أثر الماضين من سلفي
يا نفس إِن سهام الموت راشقة
كل الأنام ففي الغايات فانقذفي
يا نفس لا جرم لي إِن الوغى تلف
لكنها تلف ينجي من التلف
يا نفس لا تهني باللّه واقتحمي
حوض الردى وردي في المعرك الرجف
إن العصاة أبت ألا تساعدني
حتى تدق كدق الفهر للخزف
هذا المقال إِلى كل الورى نذر
من كل مؤتلف منهم ومختلف
من شاء ينصرنا فاللّه ينصره
أو كان يكره نصر اللّه فليقف
ثم الصلاة على المختار أحمد ما
لاح الصباح ولاح البرق في الفيف","<p class=""d-inline-block px-2 mt-0 mb-1 poem-control main-color"">عدد الابيات : 56</p>",إبراهيم الحضرمي,اليمن,قصائد رومنسيه,عموديه,بحر البسيط
"أعاكفة ذا الفرع يا أم كامل
أما نشره أحلا بعين المقاتل
قفي فانشريه ما النخيل بطلعها
بأحسن منه بعد سدل العثاكل
وغلي بأدهان الغوالي متونه
فإني كذا أهوى فروع الحلائل
ومن فاخر الحلى البسي التبر هكذا
قروظاً كهذي أو كهذي الجلائل
ولا تلبسي إلا حروزاً كهذه
عليك كذى خضر أو خضر الغلائل
وما كسخام الجعد في خضرة الحلي
على البضة البيضا وحمر الحجائل
ولكن شماريخ الاكاليل كفرت
محياك فاجلي بعض هذي الاكالل
وميدي على ما أن تميدي ترجعاً
كأغصان بان بين فهر وماحل
وسامي الظبا بالجيد حسناً واخجلي
عيون المها وارني بعينيك قاتلي
وحسبك تجديد الوذائل منتهى
فحلتها يفضحن برق الوذايل
وعودي إلى نظم العقود لكي أرى
خضابك في كف لطيف الأنامل
وإن شئت فاستاكي ولا تتعللي
بغزل فتطهير النسا في المغازل
وإلا اقبلي أو أنظري أو تحدثي
إلي ولو بالعتب أو بالمعاذل
جمالك لما أن تكامل كان لي
على صورة الخيرات إحدى الدلائل
فصرت على نهج الجهاد مصمماً
أهيم أمام القاصرات الحوائل
وعينيك يا غرثا الوشاحين إنني
أقاسيهما عن حسنك المتكامل
واذكر يا ريا الخلاخل ضبحها
خلاخلها إذ أنت ريا الخلاخل
ويخطر يا وهنانة المشي ذكرها
ببالي إذا تمشين مشي التكاسل
وخلفك أرداف ربت فتدافنت
كدعص على دعص من الرمل هائل
وحسن النسا ما لم تسام رقابها
وترتج عن أكفالها غير كامل
إلا أنني قد تبت من كل لفظة
مدحت بها في الشعر أهل الأباطل
وباك على ما كان مني وقد جرى
من القول فيهم في الليالي الأوائل
فواللّه ما واللّه أقصد مدحهم
لترفيع ذكراهم ولا حب نائل
وإِني لاولى الناس بالبعد منهم
ولكنما الصادي كثير التحايل
ظننت بهم ظناً فضنوا وربما
تزل نعال بالرجال الأفاضل
إِلا أن حسن الظن بالناس وهنة
وعجز وإِن الدهر جم الغوائل
الا هي الا هي أنت أنت بقصتي
عليم وأنت المبتلي بالنوازل
حملت لك الميثاق ثم تخاذلت
بعلمك أنصاري وزاغت جحافلي
وحارت وأنت الشاهد اليوم ثروتي
وولت بخيلي والرماح الذوابل
وأصبحت مكسور الجناحين مفرداً
لهيفاً أقاسي الذل بين القبائل
أطاطي لأهل الظلم رأسي تضعضعاً
وأفرش خدى للدناة الأراذل
وأنظر ما لا أرتضي فيك جهرة
وأغضي وفي صدري كوقع الجنادل
ووطيت عيني للخدوع بخدها
وإِني لاقذا من كحال التكاحل
أحاول بالاغضا امالة ذي الورى
إليك فأعمى الحزم عين الوسائل
فها أنا ذا بالرغم والصغر تائب
إليك مليك الملك توبة وائل
من الاثم في الاعلان والسر في الخطا
وفي العمد في العرفان أو في التجاهل
فيا غافر الذنب العظيم تعاظمت
ذنوبي فكفرها وحطَّ حمائلي
ولا تبتل بالنار لا أنا لا أبي
وأمي ولا الاخيار يوم الزلازل
أجرنا فلا نقوى على زجر مالك
إِذا قال يا ناراً حطمي ذا وذا كلي
أجرنا أجرنا من لظى النار كلنا
لظى آه من نزع الشوى والأباطل
ولا طاقة فينا لقمع مقامع
ولا حمل أغلال وسحب سلاسل
ويا رب أوزعني بشكرك واهدني
إلى كل ما ترضاه يا ذا الفضائل
ولا تنسني ذكراك رب توفني
على نهج من أرسلته بالرسائل
محمدنا الداعي إليك فحيَّه
وصل عليه بالضحى والأصائل","<p class=""d-inline-block px-2 mt-0 mb-1 poem-control main-color"">عدد الابيات : 44</p>",إبراهيم الحضرمي,اليمن,قصائد رومنسيه,عموديه,بحر الطويل
"لما رأتني قد شددت محزمي
وقمت نحو الاعوجي الشيظم
تزينت بحليها المنظم
وضمخت جثمانها بالعندم
وأقبلت في مطرف مسهَّم
تسحب أذيالاً من الابر يسم
بين الحجال والسوار المفعم
حتى لوت بنانها بمخذمي
ودمعها مثل الرشاش المرهم
تبكي بكاء الراحم المسترحم
خود من الخود الخراد الوشم
عنقاء كالغصن الرطيب الاقوم
بيضاء كحلاً تحت فرع أسحم
رقراقة الخدين ملسا اللهزم
براقة اللبات حسنا المبسم
مخطوطة المتنين شما المخطم
رضراضة زينت بكشح أهضم
غائصة الخلخال ريا المعصم
كالبيضة الجردا من التنعم
ترفل في برد الشباب الأنعم
كأنها في فرعها المنسجم
بدر بدا بين الغمام الأسحم
كأنها عند انسلال الأنجم
رأس القنيف الأبيض المطهم
كأنما اعجازها إذ ترتمي
أكتاف كثبان الرمال الركم
قد فتنتني بالجمال الاتمم
وآلمتني بالبكاء المؤلم
فصرت كالمبدد المقسم
مودة ورحمة لم أكتم
أيتها العيناء إِياي ارحمي
وأقلعي عن البكا قدك أسلمي
أقرحت قلبي يا ابنة القوم احلمي
ما بالك اليوم وللتألم
أسرّك المثوى على التهضم
والدين يوطأ خده بالمنسم
ما يا ابنة الأشياخ ذا من أمم
ولا عرفت قط ذا من هممي
إني على ما تعلمين فاعلمي
أغض طرفي عنك غض المرغم
وأشتري ديني بدنياي افهمي
وأركب الأهوال كالمصمم
إِذا عني ديني بذم أو رمي
فكيف وهو اليوم كالمهدم
أثوى لديك اليوم كفي واكرمي
يكفيك أني ويك كالمسقم
أما ترين كيف لاحت أعظمي
مما أقاسيه من التهمم
إِذا جفا النوم عيون النوّم
لا تطمعي يا هذه فخيمي
ليس الثواء من شعار الأشهم
كيف الثوى والكف غير أجذم
والسيف ماضي الحد والانف حمي
وهمتي مقرونة بالمرزم
وعزمتي تصدع صلد الصلدم
ومغنمي حتفي وحتفي مغنمي
سلامتي عندي إِذا لم أسلم
يا نعمة ما مثلها من أنعم
إِن أدرجوني في ثيابي بدمي
لا شرف أعلى من التقحّم
واقطعي إِن شئت وصلي واصرمي
وإِن ضربت هامة الغشمشم
وخضت بالسيف ضحاضيح الدم
فأهّلي وسهلي وكرّمي
وقبلي سيفي ورمحي والثمي
إِن الجبان لا يقاس بالكمي
ليس الجبان كالشجاع الضيغم
ليس يساوي مستكين مكتم
يحمى كما تحمى ذوات السوم
بفارس سميدع مستلئم
يحامل الفرسان فوق أدهم
كم بين ذا وذاك كم كم وكم
أين السما من قعر بحر القلزم
يحمي الشجاع دينه ويحتمي
والرذل ما بين المتاع مكتم
بعداً لسيف صارم لم يسلم
ولامرىء عند اللقا لم يزحم
هيها لعذرا طرقت بالحلم
إِن عاقها الحبل بطفل مشئم
لا وضعت عرس فتى في الديم
إِن لم يكن إِلا لكسب الدرهم
لا تفرح الحوراء بالغليم
إِن كان لا يفلل حد المخذم
قد علمت والدتي من شيمي
ما لفعت في خرق أو أدم
يوم ولدت لم تُباشر رحمي
إِن لأحمي دينها وأحتمي
كما حمى قيس أبى في القدم
للمصطفى حصن شبام الاقوم
أنا الغلام المتحلي بالدم
المعتلي بالدين لا بالأمم
أدين دين المصطفى المكرم
من معرب يسمو له أو معجم
أقفو سبيل جابر ومسلم
وابن الرحيل العالم المحكم
إِني إِلى المستنصرين أنتمي
إِني لارباب العلى لاستمي
إِني من القوم القيام القوّم
الرائمين فوق روم الرومّ
الشارئين الخطباء الحكم
الباهرين بالمقال المفحم
كابني بذيل وابن حصن المعلم
والراسبي الشاريء المعمم
وابن حدير السيد المقدم
وطالب الحق ابن يحيى الحضرمي
وابن حميد ذي العلوم الضيغم
أنا لأهل العدل والتقدم
أنا لأصحاب الصراط القيم
الدين ما دنا بلا توهم
الحق فينا الحق غير أطسم
أما ترانا إِذ أهّنا للقم
وإِذ علت لنا يد لم توقم
يا جاهلاً بأمرنا لا تغشم
توسمن أو سل أولي التوسم
سل من حوى صنعاً من القويسم
والمكَّتين بالقنا سل تعلم
سل كم صرعنا بقديد وافهم
بالفارس المختار أكرم وأكرم
سل من غزى وادي القرى بالصيلم
بلج الذي لألف قرن ينتمي
كم أشبعت نصالنا من رخم
وكم رعى أجسادنا من قشعم
حب الشهادات وعشق الكرم
زايل ما يبني وبين مجثمي
للّه بعنا وطناً لم يذمم
للّه عطلنا رضاب الملئم
للّه رمّلنا صباح الكرم
ونوتم الأبنا وإن لم نوتم
إني خرجت كاشفاً للظلم
بنعمة الهادي السلام المنعم
إذ قصمت عرى الذمام المبهم
وانحل عقد كل عقد مبرم
أين الذين اقسموا بالحكم
في المسجد الأكبر جهد المقسم
أن يطفؤا ما للهدى من علم
ويهدموا الحق بكل مهدم
إنا برزنا ببقيع السلم
والمرهفات بيننا لم تقسم
نحن الألى في الجحفل العرمرم
نحمل أسباب المنايا المبرم
قد خصص العفو لأهل الندم
والطعن والضرب لمن لم يندم
إنا بأيدينا نروي من ظم
إنا تركنا عاد وعظ القلم
السيف أمضى من مناجاة الفم
من صم سمعاً عن عظاة الحكم
فالسيف ينفي ما به من صمم
الدين بالسيف منيع الحرم
الكفر بالسيف عظيم المأثم
ضرب كأفواه الكلاب الشبم
أنفذ حكماً من خطاب محكم
طعن كأيدع المخاض الكوم
أمضى قضيات من التكلم
ستين شهراً يا أولي التغشم
شاهدتموني بالجفا والجشم
لكن وجدتم صابراً لم يسأم
ذا عزمة مشحوذة لم تكهم
لا زال يغشي الزند حد المخذم
حتى رماكم بذوات اللجم
بالخيل والغارات يا بن الهيتم
أطلق جياد الخيل لا تستجهم
الخيل تحوي الخيل مثل الحوم
أحسبها من موكب محر نجم
كم من صريع بينها محرجم
وكم قتيل تحتها ملعثم
قد صبغت أثوابه بالعندم
لو فرست فرسان أهل التهم
ما قدموا الخيل أمام السوم
اليوم نغشي الخيل خيلاً ترتمي
ونثخن الرجل برجل مقدم
اليوم نرمي بثياب السلم
ونمطر الأرض دماً كالديم
لا دين ما دام الدمالم نسجم
إني باهراق الدما كالمغرم
قد أينعت جماجم لم تجزم
وحان وقت طرحها في الأكم
والكعبة البيت العتيق الأقدم
والحجر الأسعد والملتزم
والمروتين والصفا وزمزم
لئن وقى الاسلام دهراً عدمي
لا فلقن الهام فلق العجم
لأوردن البيض مس اللمم
لا دخلن الكل كير النقم
لأعصرن جمعهم كالسمسم
لا وقدن حولهم بالضرم
لا جد عن أنف كل مجرم
حتى يكون الدين دين المنعم
ويخلص الصافي من المحرم
ويل لاهل الشرك من جهنم
هم نسجوا ظلام كل مظلم
هم شاهدوا الكفار بالتلعثم
هم لقموا الاشرار مال اليتم
هم معصم للكفر أي معصم
أعمامهم حقاً وحق الأسحم
أيمة قبلي ذلال الخطم
بزعمهم خانوا وزعم الزعم
يهزمهم عقر حمار أدغم
ليت الذي قام بهم لم يقم
من أجل ذا ضل أولو التفهم
هلا قفوا أثر النبي المحكم
وحاولوا بالبيض كشف الغمم
والمصطفى قد كان حلو الكلم
وما أجابه أو لو التغشم
حتى دهاهم بغته في الحرم
بجحفل كالليل داج أسجم
عليه تسليم السلام الأكرم","<p class=""d-inline-block px-2 mt-0 mb-1 poem-control main-color"">عدد الابيات : 103</p>",إبراهيم الحضرمي,اليمن,قصائد رومنسيه,عموديه,بحر الرجز
"وافى سلام من الأحبه
رعوا به ذمة المحبه
حيوا فأحيوا به محبا
مضنى عليل الفؤاد صبه
أجرى الهوى دمعه صبيبا
دما على نأيهم وصبه
وأضرم الوجد بالتجافي
في القلب جمر الأسى وشبه
نار بذات الضلوع شبت
وأصل نار الغرام شبه","<p class=""d-inline-block px-2 mt-0 mb-1 poem-control main-color"">عدد الابيات : 5</p>",عبد الله فكري,مصر,قصائد رومنسيه,عموديه,بحر مخلع البسيط
"وليلة قد وفى لي
حبي بها بعض وعده
لم أرشف الراح حتى
مددتها نحو بنده
ولا تمسكت فيها
إلا بنفحة نده
ولا صحبت شقيقاً
الا الذي فوق خده
ولا جنيت سوى ما
جمعت من غض ورده","<p class=""d-inline-block px-2 mt-0 mb-1 poem-control main-color"">عدد الابيات : 5</p>",عبد الله فكري,مصر,قصائد رومنسيه,عموديه,بحر المجتث
"وبدر تبدّى شاهراً سيف جفنه
فروّع أهل الحب من ذلك الشهر
وليلة أبصرنا هلال جبينه
علمنا يقينا أنها غرّة الشهر","<p class=""d-inline-block px-2 mt-0 mb-1 poem-control main-color"">عدد الابيات : 2</p>",عبد الله فكري,مصر,قصائد رومنسيه,عموديه,بحر الطويل
"كأن ورداً لاح في كمه
يزهو بثوبي خضرة واحمرار
ياقوتة في سندس أخضر
أو وجنة خط عليها عذار","<p class=""d-inline-block px-2 mt-0 mb-1 poem-control main-color"">عدد الابيات : 2</p>",عبد الله فكري,مصر,قصائد رومنسيه,عموديه,بحر السريع
