Poem,Number of Versus,Poet,Century,Label,Type,Metre
"راقَ الزّمانُ وَبِالجمالِ الأنْفَسِ
وافى الرّبيعُ فيا سُرورَ الأنفُسِ
أَحيا الرّبيعُ شَبابَهُ وأَعادَهُ
بَعدَ المَشيبِ رِدا الشّبيبةِ يَكتسي
وَعَلى الرّياضِ اِنصَبَّ حتّى خلتُه
إِذ صَبَّ خيطانَ اللُّجَينِ الأنفسِ
نَسجَت بِها أَوراقها وَزُهورها
وَتَشكَّلت بِمنوّعٍ وَمُجنَّسِ
مِن أَزرقٍ مَع أَبيضٍ مع أحمرٍ
مَع أَخضرٍ زاهٍ وَأَحمرَ ألعسِ
فَكلازَوردٍ فَاللّجين فَعَسجدٍ
فَزمرّدٍ مع أَحمرٍ من سندسِ
وَلِجِ الرّياضَ تَرى الزّهورَ جَواهِراً
قَد كُلِّلَت أَشجارُها في الأرؤُسِ
فَاِجْنِ الورودَ بِناظِريك مُحدِّقاً
وَمُقبِّلاً وَجناتها بِالمعطسِ
ثمَّ اِعتَنِقْ فيها عَرائسَ زهرها
وَتَجاهرنَّ على عيونِ النرجسِ
وَاِملَأ كؤُوسَ الصفوِ أُنساً وارتشِفْ
خَمرَ المَسرَّةِ مِن شِفاهِ الأَكؤسِ
وَاِدخُل بها تيكَ الرّياضَ مغرِّداً
وَاِجلِس إِلى ندمانِها وَاِستَأنسِ
وَمُطارِحاً أَكياسَهم خَبرَ الهوى
أَحلى الحديث معَ النديمِ الكيِّسِ
فَالورد مُنفَتِحاً عَلى أَغصانِهِ
مِثلُ النّجومِ تُضيُء جُنحَ الحِنْدسِ
أَزرارُه قببُ العَقيق إِذِ اِعتَلت
عمَدَ الزمرُّدِ تاهَ كلّ مهندسِ
وَالياسمينُ دَراهمٌ نُثِرَت عَلى
كِلَلِ الزمرُّدِ بَهجَةً لِلأَنفُسِ
وَالأقحُوان فَكالثّغورِ بَواسِماً
فيها الرّياضُ وجوهُها لَم تعبسِ
ثُمّ الشقيق الغَضَّ كلّ شقيقةٍ
فُنجانُ ياقوتٍ بَديعٍ أكيسِ
قَد خِلت حبّته كَنُقطَةِ عَنبَرٍ
قَد أَمسَكَت بِشِفاهِ أَشنبَ ألعَسِ
وَالبانُ أَورَقَ يَعتَليهِ زَهرُهُ
في مَنظَرٍ بَهجٍ وَأَلين مَلمَسِ
فَفَتائِلٌ مِن عَسجَدٍ قَد عُلِّقَت
بِسَناجِقٍ خُضرٍ غَدتْ من سندسِ
حَيثُ الحَمائمُ وَالهزارُ صَوادِحٌ
يَصدَحنَ بَينَ مبكِّرٍ وَمُغلِّسِ
حَيثُ الطّيورُ بِذي الرّياضِ رَواتِع
مِن ناطقٍ شادٍ وآخَر أخرسِ
وَالرّاحُ تُبدي في الدِّنانِ فَواقعاً
وَلِسانُها أَضحى يَقولُ قمِ اِحتَسِ
فَاِجعَلْ أَباريقَ المدامِ رَواعفاً
ذوبَ العقائِق مِن قناءِ المعطسِ
وَاِسكُب دَمَ العنقودِ في الجاماتِ مِن
غالي اللُّجينِ تُصاغُ أَحسنَ أَكؤُسِ
وَاِشرَب وَلا تَخشَ المَلامَةَ مُسرفاً
وَقتَ الصَّبوحِ إِلى الغَبوقِ فَما تَسي
وَتَناولَنْها مِن يَدِ البدرِ الّذي
خَلَس العُقولَ وَقبله لَم تُخلسِ
وَالرّاحُ شَمسٌ وَالمناول بدرُنا
وَالشّمسُ مِنهُ رِدا الخَجالَةِ تَكتسي
لِتَرى اِقتِرانَ النيّرينِ بِمَجلس
وَبِيَ اِقتِرانُ النيّرينِ بِمَجلسِ
وَليَبتَدِئ بِالشّربِ وَاِشرَب سُؤرَهُ
سُؤرَ الحَبيبِ بِهِ شِفاءُ الأَنفسِ
وَاِشرَب عَلى وردِ الخُدودِ فَإِنّها
وَجَمالَها لِلوردِ أَفضلُ مغرسِ
وَكَذا عَلى آسِ العِذارِ وَنَرجسٍ
في طَرفِهِ الوَسْنان لَو لَم يَنعسِ
فَأَلذُّ شربِ الراحِ بَل أَحلاهُ ما
يَبدو عَلى وَردِ الخُدودِ وَنَرجسِ
فَإِذا تَمَكَّن سُكرُه فَبِثغرهِ
ماءُ الحَياةِ إِلَيه بادِرْ وَاِحتَسِ
فَلَئِنْ ظَفرتَ بِرَشفَةٍ مِن ريقِهِ
تَحيا الدُّنى وَلَكَ الرّدى لَم يمسَسِ
وَاِنظُر أَساليبَ المَدائِحِ راكِباً
أَوجَ البَلاغَةِ وَالبديعِ الأَنفَسِ
وَمُبالِغاً مِنها بِمَدحِ أَخي العلى
عَبد الغنيِّ الكيِّسِ اِبنِ الكيّسِ
رَبّ العلومِ أَخي المَعارفِ مَنْ لَهُ
قَد دانَ كلُّ مؤلّفٍ ومدرّسِ
المُتقِن الثّقة الصّدوق أَخي التّقى
حَسنِ الحَديثِ وَلَم يَكُن بِمدلّسِ
العالِم الحَبر الفقيه الشّافعي
بَحر لَدَيهِ كلُّ بَحرٍ قَد نُسي
مَولىً هُمام لَوذَعيّ عِندَهُ
أَهلُ الفَضائِلِ أَطرَقَت بِالأَرؤُسِ
الأَفخم الشهم المَهيب أخو العلى
صدرُ الصدور بمحفلٍ وَبِمَجلِسِ
الكامِل النّدْب الوَجيه وَسامةً
مَنْ بالمحاسِنِ والمَهابَةِ يكتسي
ما بانَ في أَقرانِهِ إِلّا اِغتَدى
كالشَّمسِ ما بين الجواري الكُنَّسِ
لَم يُشبِهُوهُ وَإِنّه لَرئِيسُهم
لَيسَ الرّئيس كَمِثل مَن لَم يَرئسِ
رب الفصاحة والبلاغة والذكا
شُوسُ القوافي طوعَه لم تشرس
أَزرى بَديعُ قَريضِهِ وَبليغِهِ
بِقَريضِ سَحبانٍ وَبِالمُتَلمّسِ
لَو أَنّهُ طَرَقت مَسامع يَعربٍ
أَلفاظُهُ لَوَصفتهُ بِالأَخرسِ
يا أَيّها النَّدْبُ الفريدُ نَباهةً
بِكَمالِ إِتقانٍ وَحُسنِ تفرُّسِ
أَهدَيتَني بِخَريدَةٍ حَسناءَ مِن
نفَسٍ عليٍّ طاهرٍ وَمُقدَّسِ
غَيداءَ بِكرٍ غادَة رُعبوبَة
في غَيرِ فِكرك مِثلها لَم يهجسِ
ما مِثلها تَلدُ القَرائِح غادةً
تَسْبي العُقولَ لَدى اِبتِهاجِ الأنّسِ
تَكسي الفَصاحَةَ وَالبَلاغَةَ حُلَّةً
نَسج البديع لِغَيرها لم تلبسِ
نِعمَ الفَصاحة وَالبلاغة حُلّةً
أَندِرْ بِها مِن حلّةٍ في المَلبَسِ
أَخْدَمْتها مِن فِكرَتي بِوَليدةٍ
تكسى العَباءة لا شفوفَ السندسِ
سُمْها بِحُسنِ السَّومِ وَاِجبُر قَلبَها
لا تَبخَسَنْ أَشياءَها لا تبخَسِ
وَاِنظُر إِلَيها بِالقّبولِ تَفضُّلاً
إِنّ القَبولَ لَها أَجلّ مونّسِ
وَاِخلَع علَيها منّةً خِلَعَ الرِّضا
منكَ الرّضاء أَجَلُّ شَيءٍ تكتسي
وَاِسلَم وَدُم بِالعزِّ مِن فَلَكِ العلى
في ذَروَةِ الفلكِ الرّفيعِ الأَطلَسِ
ما اللّيل جاءَ وَما الظّلام يَحلّه
ما الفجر قَد يَمحو ظَلامَ الحِنْدسِ
ما هَبَّ ريحٌ ما تَغنَّى بلبلٌ
ما ماسَ غُصنٌ بِالقوامِ الأملسِ
ما في اِمتِداحِكَ طابَ خَتمُ قَصيدَةٍ
كَالمِسكِ فاحَ مُطيِّباً لِلأَنفسِ","<p class=""d-inline-block px-2 mt-0 mb-1 poem-control main-color"">عدد الابيات : 62</p>",المفتي عبداللطيف فتح الله,لبنان,قصائد رومنسيه,عموديه,بحر الكامل
"ما فيهِ شَيءٌ حَسَن
بَينَ الأَنامِ رائِجُ
ما فيهِ شَيءٌ داخِل
بَل كلُّ شَيءٍ خارِجُ","<p class=""d-inline-block px-2 mt-0 mb-1 poem-control main-color"">عدد الابيات : 2</p>",المفتي عبداللطيف فتح الله,لبنان,قصائد رومنسيه,عموديه,بحر مجزوء الرجز
"بِالرّوحِ خدّاهُ ثمَّ الأنفُ بَينَهُما
تَشابَها وَهُما بَدرانِ قَد طَلَعا
تَعاشَقا عِشقَ ذي وَجدٍ حَليف جَوى
قَد زادَهُ الوَجدُ فيمَن حبّهُ ولعا
وَمِن عَفافِهِما لمّا أَنِ اِجتَمَعا
يا صاحِ بَينَهما لِلسّيفِ قَد وضعا","<p class=""d-inline-block px-2 mt-0 mb-1 poem-control main-color"">عدد الابيات : 3</p>",المفتي عبداللطيف فتح الله,لبنان,قصائد رومنسيه,عموديه,بحر البسيط
"عِذارُ حِبّي أَرى مِن حُسنِهِ
أَهلَ الهَوى أَكثَروا مِن حَمدِهِ
يا لَيتَني كُنتُه في وَجهِهِ
يا لَيتَني شَعرةً في خدِّهِ","<p class=""d-inline-block px-2 mt-0 mb-1 poem-control main-color"">عدد الابيات : 2</p>",المفتي عبداللطيف فتح الله,لبنان,قصائد رومنسيه,عموديه,بحر السريع
"ما أَجمَل الحسنَ على خُدودهِ
لا حُسنَ يَبدو مثلَ حسنِ الخدِّ
فَإِنَّ لَهُ في جونَتيهِ بَهجَةً
فَإِنّما البهجَةُ لِابنِ الوَردي","<p class=""d-inline-block px-2 mt-0 mb-1 poem-control main-color"">عدد الابيات : 2</p>",المفتي عبداللطيف فتح الله,لبنان,قصائد رومنسيه,عموديه,بحر الرجز
"أَيا حُسنَ يَومٍ في الرَّبيعِ مغيِّمٍ
بِأَبيضِ غيمٍ مِن بَديعِ الغَمائِمِ
بِهِ البردُ قَد أَضحى شَديداً بِلا اِمتِرا
فَشَمسُ الضّحى فيهِ اِرتَدَت فَروَ قاقمِ","<p class=""d-inline-block px-2 mt-0 mb-1 poem-control main-color"">عدد الابيات : 2</p>",المفتي عبداللطيف فتح الله,لبنان,قصائد رومنسيه,عموديه,بحر الطويل
"ما صَمَّمَ صَبٌّ على المَحبّةِ أَو تابْ
إِلّا وَغَرامي عَلى الصّبابَةِ قَد طابْ
يَزدادُ غَرامي عَلى النّوى وَهيامي
هَيهاتَ سلوّي وَلَو فُؤاديَ قَد ذاب
العِشقُ جُنونٌ فَلا بَراءَة منهُ
مَن ظَنَّ شِفاءً مِنَ الجُنونِ فَكَذَّاب
قَد شبت بِعِشقي وَما تَناقَصَ وَجدي
دَع عَنكَ مَلامي فَما المَلامُ لِمَن شَاب
عَلقت غَزالاً لهُ المَحاسِن رَبَّت
في حُضنِ كَمالٍ عَلى بَدايِعِ آداب
مَولود جمالٍ لَقَد تَرَعرَعَ طفلاً
في مَهدِ دَلالٍ بِهِ المَلاحةُ تَنساب
ما شَمسُ مُحيّاهُ أَشرَقَت لي إلا
وَالبدرُ تَردَّى رِدا الخسوفِ وَقَد غاب
شَمسٌ بِضِياءٍ عَلى مَشارِقِ حسنٍ
في أُفقِ بَهاءٍ عَلى المَحاسِنِ صَبّاب
في وَجنَتِهِ الورد وَالخُدود سَقَتهُ
مِن ماءِ سَناءٍ عَلى النّضارَةِ سَكّاب
وَالخدُّ عَلَيهِ العذارُ أَصبَحَ يَعلو
ما أَبدَعَ آساً عَلى الورودِ هوَ الراب
ما أَجمَلهُ مِن زُمرّد يَتَلالى
مِن فَوقِ نَضارَتهِ الجمالُ قَدِ اِنساب
قَد حَطّ بَناناً عَلى الخُدودِ تَبدّى
ما فيهِ أَضَرَّت لَظى الخدودِ وَلا ذاب
بَل يَنفُحُ طيباً بِهِ تَطيبُ نفوسٌ
ما أَطيب مِسكاً بِهِ لِروحيَ تَطياب
وَالثّغرُ كَذرّ شفاههِ كَعقيقٍ
يا فَخرَ عَقيقٍ غَدا لِذلِك صَحّاب
وَالرّيقةُ فيهِ هِيَ الزّلال وَشهد
بَل تِلكَ لَعَمري هيَ المدامَةُ وَالطاب
إِنّي وَشَذاها أُريد أَشرب منها
فَالشّربَة مِنها بِها الشّفاءُ لِأَوصاب
وَاللّحظُ حُسامٌ وَإِنّهُ لَضَعيفٌ
إِنّ فتكَ فيهِ يَكونُ أَقطعَ قرضاب
وَالسحرُ بِهِ مِنَ العقولِ تسارى
إِذ أَصبَحَ يَجري مِنَ الجُفونِ وَأَهداب
ما حَلّ بِعَقلٍ وَقَد عَداهُ بِقلبٍ
إِلّا وَلَهُ كانَ بِالسّليقَةِ سَلّاب
وَالجَفنُ بِسَهمٍ إِلى الأَضالِعِ يَرمي
ما شِمت مِثالاً لَهُ بِرَميَةِ نَشّاب
وَالقَدُّ كَرُمحٍ يميدُ خوطَةَ بانٍ
كَم أَخجَلَ غُصناً لَدى تَمايسُ إِعجاب
وَالميس سِنان لَهُ بِلينَة عطفٍ
في طَعنِ فُؤادي قَسا قَساوةَ ضرّاب
يا روحَ حَياتي وَيا حَياةَ فُؤادي
يا بَهجةَ قَلبي فَعَن عيونِيَ لا غاب
يا شَمسَ جَمالٍ وَيا كَمالَ كَمالٍ
أَنعِمِ بِوِصالٍ لِصبِّك الوَلِهِ الصاب
أَيقِن بِغَرامي وَلَوعَتي وَهيامي
لا تُبدُ حَبيبي بِعِشقِ صَبِّك مُرتاب
وَاِنظُر لِنحولي وَدَع مَقالَ عَذولي
ما العاذِلُ إِلّا عَلى المُتَيَّمِ كَذّاب
يَسعى بِفَسادٍ فَلا اِحتَظى بِمُرادٍ
إِذ شَأنُ عَذولي بِأَن ينمّ وَيَغتاب
حاشاكَ حَبيبي مِنَ القبولِ بِصبٍّ
يَهواكَ وَلَو عادَ مِن هَواكَ فَما تاب
وَاِسلَم وَدُمِ الدَّهرَ في المَحاسِن تَرقى
في عِزِّ جَمالٍ لَهُ الكياسَةُ جلباب
ما دامَ مُحبٌّ بِمَن يُحِبُّ مُعنّىً
ما رَقَّ قَريضٌ وَبِالتغزُّلِ قَد طاب","<p class=""d-inline-block px-2 mt-0 mb-1 poem-control main-color"">عدد الابيات : 30</p>",المفتي عبداللطيف فتح الله,لبنان,قصائد رومنسيه,عموديه,بحر السلسلة
"بِروحي مُحيّا الحِبِّ يَحوي عَجائبا
مِنَ الحُسنِ لا تَخفى على أَيّ رائي
فَقنديلُ بِلّورٍ عَلَتهُ نَضارَةٌ
لَهُ الحسنُ ضَوءٌ في كَمالِ بَهاءِ
لَهُ الوجناتُ الحُمرُ أَبهى فَتيلَةٍ
تُضيءُ بِلا رَيبٍ بِماءِ الحَياءِ","<p class=""d-inline-block px-2 mt-0 mb-1 poem-control main-color"">عدد الابيات : 3</p>",المفتي عبداللطيف فتح الله,لبنان,قصائد رومنسيه,عموديه,بحر الطويل
"النّاسُ قَد أَبصروا في عِشقِهِ وَلَهي
وَوَجنةُ الحِبِّ تَبدو وَهي مُزهِرَة
لَو أَنكَرت وَلَهي في العِشقِ عاذِلَتني
فَالشّمسُ طالِعةٌ وَالنّاسُ مُبصِرة","<p class=""d-inline-block px-2 mt-0 mb-1 poem-control main-color"">عدد الابيات : 2</p>",المفتي عبداللطيف فتح الله,لبنان,قصائد رومنسيه,عموديه,بحر البسيط
"ما العَينُ يُشبِهُها في الرَّوضِ نَرجِسُهُ
لا تَذهبَنْ إِلى التّشبيهِ بِالخوضِ
فَالحُسنُ وَالغنجُ ثمّ السّحرُ مِن حَوَرٍ
في نَرجِسِ العَينِ لا في نَرجِسِ الروضِ","<p class=""d-inline-block px-2 mt-0 mb-1 poem-control main-color"">عدد الابيات : 2</p>",المفتي عبداللطيف فتح الله,لبنان,قصائد رومنسيه,عموديه,بحر البسيط
"بَدا البدرُ في الظَّلماءِ وَالحِبُّ زائِري
وَطَرفي وطرف الحِبِّ لَيسَ بِغامِضِ
فَقُلتُ لَهُ ما أَجهل البدرَ إِذ بَدا
فَهَلّا اِختَشى مِنك الخُسوف فَلا يُضي
فَقَابله في شَمسِ الجَبينِ وغرَّةٍ
أَضاءَت وَفي مِسكِ العِذارِ وَعارِضِ","<p class=""d-inline-block px-2 mt-0 mb-1 poem-control main-color"">عدد الابيات : 3</p>",المفتي عبداللطيف فتح الله,لبنان,قصائد رومنسيه,عموديه,بحر الطويل
"قيل لي تُبْ مِن غَرامٍ
تَوبَتي مِنهُ ذنوبُ
قُلتُ سَمعاً وَاِمتِثالاً
تُبت مِنْ أَنّي أَتوبُ","<p class=""d-inline-block px-2 mt-0 mb-1 poem-control main-color"">عدد الابيات : 2</p>",المفتي عبداللطيف فتح الله,لبنان,قصائد رومنسيه,عموديه,بحر مجزوء الرمل
