Poem,Number of Versus,Poet,Century,Label,Type,Metre
"عَن يانع الحُسن بَعدَ الوَصلِ أَلواني
دَهري وَغيّر بِالهُجران أَلواني
وَما اِكتَفى بِالجَفا حَتّى رَمى خلَدي
عَمداً بسهم لَياليهِ فَأَصماني
وَلَيسَ لي عِندَهُ ذَنب يحرّضه
عَلى تلافي سِوى حُبّي وَكتماني
إِلَيكَ يا دَهر عَني قَد وَهيَ جلَدي
وَاِندقَّ عَظمي وَهدّ الوَجدُ بُنياني
وَحاصر السقمُ حصنَ الجسم فانثلمت
أَسوارُه وَاِنثَنى عَن رَأبِها باني
وَكُنتَ عاهَدتَني أَن لا تَمين فَلَم
تصدق وَأَنكرتَني مِن بَعد عرفان
وَعاذلي مرّ بي يَوماً كَعادتِه
فَما رَأى لي خَيالاً بَينَ جِيراني
فَقالَ يا أَهلَ هَذا الحَيِّ ما فَعلت
يَدُ الهَوى في شجيٍّ بَينَكُم عاني
أَناصحٌ بَعد هَذا الغيِّ أَرشدَهُ
حرصاً عَلَيهِ إِلى تَركٍ وَسلوان
أَم نالَ ما كانَ يَرجو قَبل مَصرعه
أَو فاظَ مِن فَرط أَشواقٍ وَأَشجان
قالوا سَمعنا أَنيناً مِنهُ أَورثنا
بثّاً وَعَنا تَوارى جسمُه الفاني
فَعاد فَوراً عَلى الأَعقاب مُكتَفِياً
بِما رَوى دُون تَحقيق وَتبيان
وَنَبّأ الناس أَني متُّ مِن أَسَفٍ
عَلى رَشاً ما له في حُسنه ثاني
مهفهفٍ تزدري بِالشَمس طلعتُه
وَيخجل البَدرُ مِن طَرفٍ لَهُ راني
وَأَغيدٍ دُونَهُ مِن لَحظِه خفرٌ
يَحمي شَقائقَ نعمانٍ وَعقيان
هَيهات أَرغب عَن ذُلِّي لعزته
أَو عَن ثَنَا حسنٍ في نَظم دِيوان
هُوَ الأَمير الَّذي صانَت مَناصبَه
سِياسةٌ زانَها مِنهُ بإتقان
وَقَد غَدا راسِماً أَقطارَ دائرةٍ
عُظمى عَلى مُستوى يُمنٍ وإِحسان
وَأَيَّد الحَق فيها مِن فَضائله
بِحِكَمٍ وَدِراياتٍ وَبُرهان
وَفازَ بِالسَبق في مضمار منطقه
حَتّى تَميز عَن قسٍّ وَسَحبان
فَكَم لَهُ مِن تَدابيرٍ مؤسسةٍ
عَلى ذَكاءٍ وَإنصافٍ وَإمعان
وَكَم أَضاءَت دَياجي المُشكلات بِما
لفكره مِن علا رَأيٍ وَرجحان
وَكَم لأقلامه بالحَزم قَد سَجدَت
بيضٌ وَسُمرٌ وَأَفواهٌ لنيران
فَكَيفَ يَثني عَناني عَن مَدائحه
وَنشرِ عطرِ شَذاها في الوَرى ثاني
وَالناس قَد أَجمَعوا في مصر قاطِبةً
بِأَنَّهُ لِلمَعالي خَيرُ إِنسان
وَهَذِهِ مِن سَجاياه مُحبَّرةٌ
تَنزهَّت عَن مُغالاةٍ وَنُقصان
أَهدَيتُها وَرَجائي مِن مَكارمه
أَن لا يُقابلَها مِنهُ بهجران
لِأَنَّها قَد تحلت مِن مَناقبه
بِجوهرٍ عقدُه ما شانَهُ شاني
لا زالَ في هَذِهِ الأَوطان مُمتطِياً
متنَ العلا بَينَ أَصحاب وَأَخدان
ما غرّدت في نَضير الرَوض ساجِعةٌ
شَوقاً إِلى إلفِها مِن فَوق أَغصان
أَو قُلتُ أَشكو الهَوى في بدء مدحته
عَن يانع الحُسنِ بَعدَ الوَصلِ أَلواني","<p class=""d-inline-block px-2 mt-0 mb-1 poem-control main-color"">عدد الابيات : 31</p>",صالح مجدي بك,مصر,قصائد رومنسيه,عموديه,بحر البسيط
"كَيفَ الوُصولُ إِلى مَن كانَ لي قَمَراً
بَينَ الكَواكبِ أَهواه وَيَهواني
كُلُّ المُحبين في أَجسامهم سقمٌ
مِن حسن طَلعته يا مَن تَلوماني
فَخلِّيا عَنكُما نصحي وَلا تُطِلا
في عذلِ مثلي فَسهمُ الصدِّ أَصماني
وَبادرا بمتابٍ عَن مَلامةِ مَن
يَهوى المِلاح وَمَن يَصبو لغزلان","<p class=""d-inline-block px-2 mt-0 mb-1 poem-control main-color"">عدد الابيات : 4</p>",صالح مجدي بك,مصر,قصائد رومنسيه,عموديه,بحر البسيط
"يا بَدر حُسنٍ في سَما عرفانِ
رفقاً بَصبٍّ في جَمالك فاني
وَاعطف عَلَيهِ بِزورة يَحيا بِها
وَاغنم عَظيمَ الأَجر وَالإِحسان","<p class=""d-inline-block px-2 mt-0 mb-1 poem-control main-color"">عدد الابيات : 2</p>",صالح مجدي بك,مصر,قصائد رومنسيه,عموديه,بحر الكامل
"قسماً بديني بِالصَبابةِ يا حَسَنْ
إِن بنت عَني فارَقت رُوحي البَدَنْ
وَلَئن أَمت وَجداً عَليك فَإِنني
لَم أَقض في الحُبِّ الفَرائض وَالسنَنْ","<p class=""d-inline-block px-2 mt-0 mb-1 poem-control main-color"">عدد الابيات : 2</p>",صالح مجدي بك,مصر,قصائد رومنسيه,عموديه,بحر الكامل
"إِذا ما الدَهر حرّك لي شُجوناً
وَأَرسَل في الوَرى خَلفي عُيونا
وَعانَدني وَجار وَكان عَهدي
إِذا سالَمتُهُ أَن لا يَخونا
فَلا أَخشاهُ في بَلد أَمين
وَلي ثِقةٌ بِزين العابدينا
إمام فاضل حبر لَبيب
تَناسل طاهِراً مِن طاهِرينا
لَهُ في الخَير لا تُحصى المَساعي
لِوَجه اللَه رَب العالَمينا
فَلا انفكَّ الزَمانُ لَهُ مُطيعاً
سَميعاً خاضِعاً عَبداً أَمينا
وَلا بَرحت تُناديهِ الأَماني
بِلَبَّيك مَدى الأَيام فينا
بجاه المُصطَفى خَير البَرايا
محمدنا ختام المُرسَلينا
وَآلٍ ثُمَ أَزواجٍ وَصَحبٍ
وَأَحزاب كِرام مُخلِصينا","<p class=""d-inline-block px-2 mt-0 mb-1 poem-control main-color"">عدد الابيات : 9</p>",صالح مجدي بك,مصر,قصائد رومنسيه,عموديه,بحر الوافر
"بَشير التَهاني بِالسُرور حَباني
فَأَطلقت بِالشُكر الجَميل لِساني
وَقَد كُنت قاطَعتُ الغَرام وَأَهله
عَلى رَغم لبي في الهَوى وَجِناني
وَحاصرتُ حُصن الصَبر حَتّى مَلكته
وَلَم أَكتَرث بِالنَوم حينَ جَفاني
وَعلقت آمال العذول بسلوة
لِذَنب جَناه مَن رَنا فَرَماني
وَما ذاكَ إِلّا أَنَّهُ خانَ عَهدَهُ
وَواعد غَيري في الهَوى بِتَداني
وَلَو أَنَّ لي طَرفاً يُلِمُّ بِهِ الكَرى
وَيَطرقني طَيفٌ لَهُ لَكَفاني
وَكَيفَ يَزور الطَيف مثلي وَإِنَّني
حَليفُ سهاد لِلصُدود أُعاني
وَلَو دامَ مَن أَهوى عَلى الغَدر لاشتفى
بإتلاف رُوحي في الصَبابة شاني
وَلَكنهُ لَمّا وَفى بَعد هَجره
وَأَنعم لي بِالوَصل قَبل هَواني
وَعاهَدته أَن لا يُغادر بَعدَها
وَبايَعَني طَوعاً وَقامَ بَشاني
صَبَوتُ إِلَيهِ صَبوة عامريةً
وَقاطَعت خلّاً في هَواه لحاني
فَيا لائِمي كفَّ المَلامة وَاِنتَهي
فَما اللَوم يُجدي في صَريع غَواني
وَفي مَذهَبي أَن الغَرام هُوَ الهُدى
وَأن الَّذي يَنهاكَ عَنهُ لَجاني
وَأَعجَب شَيء أَن يصدّك في الهَوى
عَن الرُشد ضلّيل بِزور بَيان
أَبى اللَه إلّا أَن أَعيش مُتَيَّماً
مُجيباً لِداعي الحُب حَيث دَعاني
مُطيعاً لِأَحكام الهَوى وَمُخالِفاً
لِرَأي سَفيهٍ بِالغَرام هَجاني
عَلى أَنَّني ما ملتُ قَط لسلوة
وَإِن ظَنّ هَذا مَن وَشى وَنَهاني
فَلَولا الهَوى لَم تَنتَشر ليَ رايةٌ
وَلَولا الهَوى ما كانَ عزُّ مَكاني
وَلَولاه ما نالَ السَعادةَ عَنتَرٌ
وَقَد أَرهَب الأَبطالَ يَوم طِعان
وَذلت لعزته المُلوك وَأَصبَحوا
عَبيداً لخطِّيٍّ لَهُ وَيَمان
فَكَم مِن جَهول هَذَّب الحُبُّ طَبعَه
وَعلَّمه ظَرفاً وَحُسنَ مَعاني
وَكَم مِن سَفيه بِالهَوى فاقَ أَحنَفاً
وَأَضحى لَهُ يُومَى بِكُلِّ بَنان
فَحتّام في دين الصَبابة وَالهَوى
يُعاندني فيمَن أُحبُّ زَماني
وَما لِفُؤادي جَنة غَير وَصله
وَلَو فَوق جَمر الهَجر مِنهُ قَلاني
أَأرغَب عَنهُ وَهوَ في الحُسن مُفرَدٌ
نَبيُّ جَمالٍ لا يُقاس بِثاني
كَما في السَخا وَالحلم وَالعلم وَالوَفا
أَميري عَليٌّ صارِمي وَسِناني
أَمير بِهِ دار العُلوم تَفاخَرَت
وَلِلفَضل فيهِ شادَ خَيرَ مَباني
فَأَما لِساني فَهوَ إِن رمت مَنعه
عَن الشُكر لِلمَولى الأَجل عَصاني
وَأَما جناني فَهوَ مغرىً بِمَدحه
فَإِن ضَلَّ لبِّي عَن ثَناه هَداني
وَيا لَيتَ شِعري هَل أَقوم بِشُكر من
بِسائر أَنواع الهِبات حَباني
فَيا قُطب دائرة السِياسة وَالذَكا
وَيا دُرّة تَزهو بِعقد جُمان
وَيا واحد الأَيّام يا مَن بِهِ سَمَت
محافلُنا الغَرا بِدُون تَواني
وَيا كَعبةً يَسعى لحجِّك جَمعُنا
لِكسب فُنون كُلّهنَّ حِسان
وَيا سَيداً لا زلتَ فينا مُوَفَّقاً
إِلى بَثِّ عرفان مَدى المَلَوان
تَهنأ بِعيد الفطر يا حاتم الوَرى
فَقد نِلت كُلَّ الأَجر في رَمَضان
وَدُونك بكراً يَملك القَلبَ حُسنُها
كَما تَملك الأَلبابَ بِنتُ دنان
وَما مَهرُها إِلّا القبول فحيِّها
بِأَسمى تَحيات وَحُسن تَهاني
فَلا زلتَ مَسروراً مُطاعاً مُبارَكاً
تقاد لَكَ العليا بِغَير عِنان
وَلا زلتَ يا اِبن الأَكرَمين مؤيداً
مِن اللَه في حفظ لَهُ وَأَمان","<p class=""d-inline-block px-2 mt-0 mb-1 poem-control main-color"">عدد الابيات : 39</p>",صالح مجدي بك,مصر,قصائد رومنسيه,عموديه,بحر الطويل
"وليلة زاد اشتياقي بها
فخلتُها من آخر العُمر
على لظى الوجد ونار الجوى
بقيتُ حتى مطلع الفجر","<p class=""d-inline-block px-2 mt-0 mb-1 poem-control main-color"">عدد الابيات : 2</p>",عبد الرحمن السويدي,العراق,قصائد رومنسيه,عموديه,بحر السريع
"حَنانَيكَ أنَّ الشيءَ بالشيء يُذكر
فلا تعجبي يا هنذ إذ صرتُ أضجر
رايت على العشّار بنتاً صغيرة
كزمزم بنتي وجهها متغيّر
فلما رأتني مقبلاً فوق حجرتي
بعِمَّتي الكبرى غدَت تتعثّر
من الخوف مني وهي في القلب حبّها
كرامة من في القلب لا زال يُذكر
فهاج غرام القلب غبّ سكونه
وسالت من العينين للوجه أبحر
أزمزمُ إني ما نسيتُك ساعةً
من الدهر هل إني بقلبك أخطر
أزمزم إن قد كنت أنت نسيتني
لِلَهو فإني بالجَفا لك أذكر
أزمزم إن أبصرت كل عشيرتي
فإني أبوهم لست أنسى وأحقر
وإن كان لعبُ الدرب أنساك والداً
فإني لا أنسى وإن كنت أُقبَر
أأنسى بُكاك إذ خرجتِ عشيةً
عليَ وهذا الذِّكر للقلب يفطر
كلانا سنسلو غير أنك خِلقةً
لك الضعف لا يأتيك منه تكدّر
وإني من شوقي إليك وحرقتي
غدوتُ ضئيلاً ربما لست أُبصَر
نسيتِ قروش الروم كيف أذبّها
عليك ولا خرجاً عليك أقتّر
وفي كل يوم ربع رومي تناله
يداك وللرقّيِّ أشري وأكسر
أروح بحرٍّ كنت تدرين ضُرّه
وآتيك بالرقيّ ولا أتكبّر
فيا بنت قلبي ليس ذلك منَّةً
عليك ولكنّي بهذا أُذكِّر
فلم لا بقيتِ يا ابنة الروح عندنا
طعامك ممزوج حليبٌ وسُكّرُ
وعندي من الهيل الذي عزّ وقعه
من الحمّص الكرديّ في الحجم أكبر
وعندي يا بنتي كثير قرنفلٍ
وعندي نبات ليس في مصر يُذكر
وعندي حلاواتٌ عجيب صنيعها
وعندي طاقاتٌ من الهند تؤثر
وكل الذي قد مرّ مدّخر لك
إذا جئت آتيك بذاك وأكثر
ولا تعط منه عائشاً حبّ خردلٍ
ولا آمناً والكل عندك يُحصَر","<p class=""d-inline-block px-2 mt-0 mb-1 poem-control main-color"">عدد الابيات : 22</p>",عبد الرحمن السويدي,العراق,قصائد رومنسيه,عموديه,بحر الطويل
"يا ليالي الهنا ووقت السعود
وزمانٍ به قد اخضرّ عودي
يا ليالي بجانب السِّيف صارت
ماضياتٍ بحقّ زينب عودي
وانشدي لي ذكر الرباب فمن
طيّ ادّكاري الرباب طال هجودي
حدِّثيني عن أختها كيف باتت
بسنا السِّيف بيتة المجهود
والأعادي يرونها كل وقتٍ
حيث كانت هناك بيت القصيد
لَبوة غاب ليثها عن شراها
فتناءت عنه بغابٍ بعيد
واختفت بين نسوة كالسعالي
وهي الآن بعدُ في تهديد
لم تزل تطلب الخلاص وأنّي
هي خشف قد أُحدِقت بقرود
لست عن نصرها تخلّفتُ لكن
أنا وحدي وخصمها في عديد","<p class=""d-inline-block px-2 mt-0 mb-1 poem-control main-color"">عدد الابيات : 9</p>",عبد الرحمن السويدي,العراق,قصائد رومنسيه,عموديه,بحر الخفيف
"سفَرَت فهيّجنا الصباح الثاني
وبدَت لنا فتثلّث القمران
وتكلّمت سحر الحلال كمثله
أو خندريسٌ من دنان الحاني
فبدا لنا برقٌ حكى برقَ الدجى
وبدت لآلٍ غُصنَ في مَرجان
خودٌ من الأعراب يقتُل جفنُها
طرق السهام وطرفها سيّان
من أحسن الأتراك أضحى وجهها
والشَعر أمسى من بني السودان
كالغصن إلا أنّ فيه شِدةً
تهتزّني ورقٍ من العِقيان
عبلاء خرساء الخلاخل من جوىً
فيها فقد كتمت على الأشجان
أدماء ما صلَبَت مُذَهَّبَ قرطها
إلا لتنصر مذهب الصلبان
ما رقّ خدّاها وأُمرِض جفنها
إلا لِتَمتُن فتنة الشيطان
قد ستَّرت قمراً بجون غمامةٍ
فبدا كبدرٍ لاح وسط دخان
بدوية لم تعرفنّ تستّراً
بل كان ذاك الستر من جرّاني
قد كان طاع القلبُ حبَّ فريدةٍ
ونهيته عن حبِّها فعصاني
وتركت كل التُرّهات بحبها
وقصرت مدحي في عظيم الشان
من جاءنا يدعو الأنام إلى سبي
ل الحق والمهدي من الرحمن
قد خصّه الرحمن بالحِكَم البهي
ة والدليل القاطع القرآني
فغدا مقيماً للشريعة آمراً
بالبِرِّ والإسلام والإيمان
خرَّت لسطوته الملوك وأفررت
وانشق خوفاً طاق ذي الأيدان
وتساقطت أركانه وتزعزعت
أركانه واهتزّ كالنشوان
قرمٌ مقيم الدين بالمسنان
ليثٌ مدمِّر دولة الأوثان
في فتيةٍ بذل النفوس يسرّهم
في عزّ دين اللَه ذي الأركان
قومٌ إذا اغبرَ السماء رأيتهم
تركوا فلاناً غائثاً بفلان
لا يرعون عن العدى كي يلبسوا ال
غبراء من حُلل النجيع القاني
سل عنهم في بدر بل في خندق
كم جندلوا من أشجع الفرسان
سل عن أبي جهلٍ ببدر إذا بدا
بين الصفوف يجول في الميدان
أين الشجاعة منه إذ أُلقي على ال
ومضاء مطروحاً من الشبان
شبّانهم ترمي الكهول من العدى
وكهولهم ضرباً بكل يماني
من جُبِّهم ناران تبدو للقرى
نار الحديد ونار فوق رعان
نالوا السيادة والعلاء بصحبة ال
طهر الزكيّ المنجب العدناني
من فاق كل الأنبياء وآدماً
فضلاً كذا الكرسي مع الرضوان
بل تربة المختار خير من ذرى ال
عرش الرفيع وخير كل جنان
يا أيها الشفّاع إني مذنب
أرجوك يوم الهول لا تنساني
بل واسقني يا كوثراً من كوثر
يوم الرجوع بحشرجٍ ملآن
فلأنت لا ترضى لنا بمذلّة
ولأنت لا ترضى لنا بهوان
ترضى يا كريم وإننا
في شدة من زفرة النيران
ثم الصلاة عليك يا علم الهدى
وكذا السلام كوابلٍ هتان
والآل والأصحاب أهل الخير
والتقوى وأهل البر والإحسان","<p class=""d-inline-block px-2 mt-0 mb-1 poem-control main-color"">عدد الابيات : 36</p>",عبد الرحمن السويدي,العراق,قصائد رومنسيه,عموديه,بحر الكامل
"عَجِبتُ لذي طرفٍ فُتِنتُ بسحره
ووجه يفوق البَدر ليلة نصفه
وصدغٍ لدى هجرانه كعقاربٍ
وعند وصال الصبّ واوات عطفه","<p class=""d-inline-block px-2 mt-0 mb-1 poem-control main-color"">عدد الابيات : 2</p>",عبد الرحمن السويدي,العراق,قصائد رومنسيه,عموديه,بحر الطويل
